{
  "protocol": "w1-cip",
  "protocol_version": "0.1",
  "session_id": "session-pump-001",
  "kind": "event",
  "event_class": "protocol_event",
  "actor": {
    "principal_type": "human",
    "principal_id": "human-owner-001"
  },
  "authorized_by": {
    "entity_type": "role_assignment",
    "entity_id": "role-assignment-owner-001",
    "entity_version": 4
  },
  "recorded_by": {
    "principal_type": "runtime",
    "principal_id": "runtime-local-001"
  },
  "correlation_id": "corr-pump-driver-001",
  "payload_schema": "urn:w1-cip:schema:0.1:versioned-entity",
  "related_events": [],
  "message_id": "evt-decision-reassessment-compensated-001",
  "type": "protocol_event.compensation_recorded",
  "sequence": 38,
  "occurred_at": "2026-08-04T15:40:00Z",
  "received_at": "2026-08-04T15:40:01Z",
  "recorded_at": "2026-08-04T15:40:02Z",
  "causation_id": "evt-decision-reassessment-required-001",
  "entity": {
    "entity_type": "protocol_event",
    "entity_id": "evt-decision-reassessment-compensated-001",
    "entity_version": 1
  },
  "precondition": {
    "mode": "create",
    "expected_absent": true,
    "target_identity": {
      "entity_type": "protocol_event",
      "entity_id": "evt-decision-reassessment-compensated-001"
    }
  },
  "payload": {
    "entity": {
      "entity_type": "protocol_event",
      "entity_id": "evt-decision-reassessment-compensated-001",
      "entity_version": 1
    },
    "created_by_event_id": "evt-decision-reassessment-compensated-001",
    "legal_payload_schema": "urn:w1-cip:entity-payload:0.1:protocol-event",
    "legal_payload": {
      "event_type": "compensation_recorded",
      "subject": {
        "entity_type": "protocol_event",
        "entity_id": "evt-decision-reassessment-required-001",
        "entity_version": 1
      },
      "reason": {
        "code": "challenge_reopen_reversed",
        "description": "The reopening record was invalidated by an independently verified procedural correction."
      },
      "classification": "internal",
      "propagation": "none",
      "blocking": false,
      "compensation": {
        "compensates_event": {
          "entity_type": "protocol_event",
          "entity_id": "evt-decision-reassessment-required-001",
          "entity_version": 1
        },
        "reason": "Disable only the operational effect; preserve both events in the immutable history."
      }
    }
  }
}
