{
  "protocol": "w1-cip",
  "protocol_version": "0.1",
  "message_id": "evt-role-assignment-executor-001",
  "session_id": "session-demo-001",
  "kind": "event",
  "event_class": "protocol_event",
  "type": "entity.version.created",
  "actor": {
    "principal_type": "service",
    "principal_id": "orchestrator-01"
  },
  "on_behalf_of": {
    "principal_type": "human",
    "principal_id": "human-owner-001"
  },
  "authorized_by": {
    "entity_type": "role_assignment",
    "entity_id": "role-assignment-owner-001",
    "entity_version": 1
  },
  "recorded_by": {
    "principal_type": "runtime",
    "principal_id": "orchestrator-runtime-01"
  },
  "occurred_at": "2026-08-04T15:00:59Z",
  "received_at": "2026-08-04T15:01:00Z",
  "recorded_at": "2026-08-04T15:01:00Z",
  "sequence": 3,
  "correlation_id": "session-bootstrap-demo-001",
  "causation_id": "msg-role-assignment-executor-001",
  "related_events": [],
  "entity": {
    "entity_type": "role_assignment",
    "entity_id": "role-assignment-executor-001",
    "entity_version": 1
  },
  "precondition": {
    "mode": "create",
    "expected_absent": true,
    "target_identity": {
      "entity_type": "role_assignment",
      "entity_id": "role-assignment-executor-001"
    }
  },
  "payload_schema": "urn:w1-cip:schema:0.1:versioned-entity",
  "payload": {
    "entity": {
      "entity_type": "role_assignment",
      "entity_id": "role-assignment-executor-001",
      "entity_version": 1
    },
    "created_by_event_id": "evt-role-assignment-executor-001",
    "legal_payload_schema": "urn:w1-cip:entity-payload:0.1:role-assignment",
    "legal_payload": {
      "subject": {
        "principal_type": "agent",
        "principal_id": "agent-electronics-01"
      },
      "role": "executor",
      "authority_scope": {
        "operations": [
          "contribution.create",
          "contribution.next_version"
        ]
      },
      "status": "active",
      "valid_from": "2026-08-04T15:01:00Z",
      "valid_until": "2026-08-04T17:00:00Z",
      "assignment_reason": "prepare the component-selection proposal",
      "basis": [
        {
          "entity_type": "agent_card",
          "entity_id": "agent-electronics-01",
          "entity_version": 1
        },
        {
          "entity_type": "team_plan",
          "entity_id": "team-plan-01",
          "entity_version": 1
        }
      ]
    }
  }
}
