{
  "protocol": "w1-cip",
  "protocol_version": "0.1",
  "message_id": "evt-task-created-001",
  "session_id": "session-demo-001",
  "kind": "event",
  "event_class": "protocol_event",
  "type": "entity.version.created",
  "actor": {
    "principal_type": "runtime",
    "principal_id": "orchestrator-runtime-01"
  },
  "on_behalf_of": {
    "principal_type": "human",
    "principal_id": "human-owner-001"
  },
  "authorized_by": {
    "entity_type": "role_assignment",
    "entity_id": "role-assignment-owner-001",
    "entity_version": 3
  },
  "recorded_by": {
    "principal_type": "runtime",
    "principal_id": "orchestrator-runtime-01"
  },
  "occurred_at": "2026-08-04T15:11:00Z",
  "received_at": "2026-08-04T15:11:01Z",
  "recorded_at": "2026-08-04T15:11:01Z",
  "sequence": 13,
  "correlation_id": "run-pump-001",
  "causation_id": "msg-task-create-001",
  "related_events": [],
  "entity": {
    "entity_type": "task",
    "entity_id": "task-driver-selection-001",
    "entity_version": 1
  },
  "precondition": {
    "mode": "create",
    "expected_absent": true,
    "target_identity": {
      "entity_type": "task",
      "entity_id": "task-driver-selection-001"
    }
  },
  "payload_schema": "urn:w1-cip:schema:0.1:versioned-entity",
  "payload": {
    "entity": {
      "entity_type": "task",
      "entity_id": "task-driver-selection-001",
      "entity_version": 1
    },
    "created_by_event_id": "evt-task-created-001",
    "legal_payload_schema": "urn:w1-cip:entity-payload:0.1:task",
    "legal_payload": {
      "goal": {
        "entity_type": "goal_contract",
        "entity_id": "goal-pump-driver-001",
        "entity_version": 1
      },
      "team_plan": {
        "entity_type": "team_plan",
        "entity_id": "team-plan-pump-001",
        "entity_version": 1
      },
      "title": "Prepare the motor-driver selection proposal",
      "description": "Evaluate the supplied candidates against the electrical constraints and produce one structured proposal.",
      "phase": "execution",
      "status": "created",
      "assigned_role_assignment": {
        "entity_type": "role_assignment",
        "entity_id": "role-assignment-executor-001",
        "entity_version": 1
      },
      "dependencies": [],
      "required_outputs": [
        {
          "output_id": "candidate-proposal",
          "entity_type": "contribution",
          "description": "A structured candidate-selection proposal.",
          "required": true
        }
      ],
      "budget_allocation": {
        "max_model_calls": 2,
        "max_tool_calls": 2,
        "max_elapsed_seconds": 600
      },
      "required_context_fields": [
        "available_supply_voltage",
        "user_skill_level"
      ]
    }
  }
}
