{
  "protocol": "w1-cip",
  "protocol_version": "0.1",
  "message_id": "evt-contribution-proposal-001",
  "session_id": "session-demo-001",
  "kind": "event",
  "event_class": "protocol_event",
  "type": "entity.version.created",
  "actor": {
    "principal_type": "runtime",
    "principal_id": "orchestrator-runtime-01"
  },
  "on_behalf_of": {
    "principal_type": "agent",
    "principal_id": "agent-electronics-01"
  },
  "authorized_by": {
    "entity_type": "role_assignment",
    "entity_id": "role-assignment-executor-001",
    "entity_version": 1
  },
  "recorded_by": {
    "principal_type": "runtime",
    "principal_id": "orchestrator-runtime-01"
  },
  "occurred_at": "2026-08-04T15:20:00Z",
  "received_at": "2026-08-04T15:20:01Z",
  "recorded_at": "2026-08-04T15:20:01Z",
  "sequence": 15,
  "correlation_id": "run-demo-001",
  "causation_id": "msg-contribution-proposal-001",
  "related_events": [],
  "entity": {
    "entity_type": "contribution",
    "entity_id": "proposal-driver-001",
    "entity_version": 1
  },
  "precondition": {
    "mode": "create",
    "expected_absent": true,
    "target_identity": {
      "entity_type": "contribution",
      "entity_id": "proposal-driver-001"
    }
  },
  "payload_schema": "urn:w1-cip:schema:0.1:versioned-entity",
  "payload": {
    "entity": {
      "entity_type": "contribution",
      "entity_id": "proposal-driver-001",
      "entity_version": 1
    },
    "created_by_event_id": "evt-contribution-proposal-001",
    "legal_payload_schema": "urn:w1-cip:entity-payload:0.1:contribution",
    "legal_payload": {
      "goal": {
        "entity_type": "goal_contract",
        "entity_id": "goal-pump-driver-001",
        "entity_version": 1
      },
      "team_plan": {
        "entity_type": "team_plan",
        "entity_id": "team-plan-pump-001",
        "entity_version": 1
      },
      "task": {
        "entity_type": "task",
        "entity_id": "task-driver-selection-001",
        "entity_version": 4
      },
      "authored_by_role_assignment": {
        "entity_type": "role_assignment",
        "entity_id": "role-assignment-executor-001",
        "entity_version": 1
      },
      "status": "active",
      "limitations": [
        "synthetic fixture only"
      ],
      "confidence": {
        "level": "high",
        "basis": "bounded comparison over the supplied fixture",
        "calibrated": false
      },
      "contribution_type": "proposal",
      "fulfills_output_id": "candidate-proposal",
      "content": {
        "subject": "Select candidate-b",
        "description": "Select candidate-b because candidate-a does not satisfy the supplied startup-current constraint.",
        "rationale": "Candidate-b is the only supplied option whose stated peak capability covers 18 A for 0.8 s.",
        "alternatives_considered": [
          "candidate-a"
        ]
      },
      "context_usage": [
        {
          "grant": {
            "entity_type": "context_grant",
            "entity_id": "context-grant-executor-001",
            "entity_version": 1
          },
          "fields_used": [
            "available_supply_voltage"
          ],
          "purpose_code": "adapt_component_explanation"
        }
      ],
      "classification": "internal"
    }
  }
}
