{
  "protocol": "w1-cip",
  "protocol_version": "0.1",
  "message_id": "evt-approval-proposal-revision-001",
  "session_id": "session-demo-001",
  "kind": "event",
  "event_class": "protocol_event",
  "type": "entity.version.created",
  "actor": {
    "principal_type": "runtime",
    "principal_id": "orchestrator-runtime-01"
  },
  "on_behalf_of": {
    "principal_type": "agent",
    "principal_id": "agent-decision-01"
  },
  "authorized_by": {
    "entity_type": "role_assignment",
    "entity_id": "role-assignment-decision-001",
    "entity_version": 1
  },
  "recorded_by": {
    "principal_type": "runtime",
    "principal_id": "orchestrator-runtime-01"
  },
  "occurred_at": "2026-08-04T15:25:59Z",
  "received_at": "2026-08-04T15:26:00Z",
  "recorded_at": "2026-08-04T15:26:00Z",
  "sequence": 35,
  "correlation_id": "run-demo-001",
  "causation_id": "evt-review-startup-current-001",
  "related_events": [],
  "entity": {
    "entity_type": "approval",
    "entity_id": "approval-proposal-revision-001",
    "entity_version": 1
  },
  "precondition": {
    "mode": "create",
    "expected_absent": true,
    "target_identity": {
      "entity_type": "approval",
      "entity_id": "approval-proposal-revision-001"
    }
  },
  "payload_schema": "urn:w1-cip:schema:0.1:versioned-entity",
  "payload": {
    "entity": {
      "entity_type": "approval",
      "entity_id": "approval-proposal-revision-001",
      "entity_version": 1
    },
    "created_by_event_id": "evt-approval-proposal-revision-001",
    "legal_payload_schema": "urn:w1-cip:entity-payload:0.1:approval",
    "legal_payload": {
      "goal": {
        "entity_type": "goal_contract",
        "entity_id": "goal-pump-driver-001",
        "entity_version": 1
      },
      "team_plan": {
        "entity_type": "team_plan",
        "entity_id": "team-plan-pump-001",
        "entity_version": 1
      },
      "task": {
        "entity_type": "task",
        "entity_id": "task-approve-revision-001",
        "entity_version": 4
      },
      "approval_kind": "operation_authorization",
      "decision": "approved",
      "approved_by_role_assignment": {
        "entity_type": "role_assignment",
        "entity_id": "role-assignment-decision-001",
        "entity_version": 1
      },
      "decided_at": "2026-08-04T15:26:00Z",
      "effective_from": "2026-08-04T15:26:00Z",
      "expires_at": "2026-08-04T15:36:00Z",
      "targets": [
        {
          "entity_type": "contribution",
          "entity_id": "proposal-driver-selection-001",
          "entity_version": 1
        }
      ],
      "granted_to_role_assignment": {
        "entity_type": "role_assignment",
        "entity_id": "role-assignment-executor-001",
        "entity_version": 1
      },
      "authorization": {
        "operation": "contribution.next_version",
        "target_condition": {
          "mode": "next_version",
          "target": {
            "entity_type": "contribution",
            "entity_id": "proposal-driver-selection-001",
            "entity_version": 1
          }
        },
        "usage_mode": "one_time"
      },
      "basis_refs": [
        {
          "entity_type": "review",
          "entity_id": "review-startup-current-001",
          "entity_version": 1
        },
        {
          "entity_type": "challenge",
          "entity_id": "challenge-startup-current-001",
          "entity_version": 1
        }
      ],
      "conditions": [
        "The revision must replace candidate-a and preserve the recorded evidence trail."
      ],
      "classification": "internal",
      "status": "active",
      "limitations": [
        "synthetic fixture only"
      ],
      "fulfills_output_id": "proposal-revision-approval"
    }
  }
}
