{
  "protocol": "w1-cip",
  "protocol_version": "0.1",
  "message_id": "evt-goal-contract-created-001",
  "session_id": "session-demo-001",
  "kind": "event",
  "event_class": "protocol_event",
  "type": "entity.version.created",
  "actor": {
    "principal_type": "service",
    "principal_id": "orchestrator-01"
  },
  "on_behalf_of": {
    "principal_type": "human",
    "principal_id": "human-owner-001"
  },
  "authorized_by": {
    "entity_type": "role_assignment",
    "entity_id": "role-assignment-owner-001",
    "entity_version": 2
  },
  "recorded_by": {
    "principal_type": "runtime",
    "principal_id": "orchestrator-runtime-01"
  },
  "occurred_at": "2026-08-04T15:03:59Z",
  "received_at": "2026-08-04T15:04:00Z",
  "recorded_at": "2026-08-04T15:04:00Z",
  "sequence": 5,
  "correlation_id": "run-demo-001",
  "causation_id": "msg-goal-contract-create-001",
  "related_events": [],
  "entity": {
    "entity_type": "goal_contract",
    "entity_id": "goal-pump-driver-001",
    "entity_version": 1
  },
  "precondition": {
    "mode": "create",
    "expected_absent": true,
    "target_identity": {
      "entity_type": "goal_contract",
      "entity_id": "goal-pump-driver-001"
    }
  },
  "payload_schema": "urn:w1-cip:schema:0.1:versioned-entity",
  "payload": {
    "entity": {
      "entity_type": "goal_contract",
      "entity_id": "goal-pump-driver-001",
      "entity_version": 1
    },
    "created_by_event_id": "evt-goal-contract-created-001",
    "legal_payload_schema": "urn:w1-cip:entity-payload:0.1:goal-contract",
    "legal_payload": {
      "title": "Select a compatible motor driver for the reference pump fixture",
      "objective": "Select one candidate motor driver that satisfies the supplied electrical constraints and produce a traceable decision explaining why the rejected candidate failed.",
      "scope": {
        "in_scope": [
          "Evaluate only the synthetic candidates and measurements supplied in the fixture.",
          "Compare continuous and startup-current limits."
        ],
        "out_of_scope": [
          "Real product certification.",
          "Physical installation or procurement."
        ]
      },
      "deliverables": [
        {
          "deliverable_id": "driver-selection-decision",
          "description": "An approved selection decision naming the compatible candidate.",
          "kind": "decision",
          "required": true,
          "decision_subject": "motor_driver_selection"
        },
        {
          "deliverable_id": "verification-summary",
          "description": "A summary of the startup-current verification and relevant limitations.",
          "kind": "report",
          "required": true
        }
      ],
      "constraints": [
        {
          "constraint_id": "supply-voltage",
          "statement": "The selected candidate must support the supplied 12 V fixture.",
          "criticality": "required",
          "verifiability": "deterministic"
        },
        {
          "constraint_id": "startup-current",
          "statement": "The selected candidate peak-current capability must cover 18 A for 0.8 s.",
          "criticality": "critical",
          "verifiability": "deterministic"
        }
      ],
      "success_criteria": [
        {
          "criterion_id": "compatible-driver-selected",
          "statement": "The approved decision selects a candidate that passes both voltage and startup-current checks.",
          "applies_to": [
            "driver-selection-decision"
          ],
          "verifiability": "deterministic",
          "acceptance_effect": "required_for_completion",
          "method_hint": "Evaluate the pinned candidate data with the validated fixture rules.",
          "verifies_constraints": [
            "supply-voltage",
            "startup-current"
          ]
        },
        {
          "criterion_id": "verification-disclosed",
          "statement": "The result reports the verification method, evidence, and limitations.",
          "applies_to": [
            "verification-summary"
          ],
          "verifiability": "source_based",
          "acceptance_effect": "required_for_completion"
        }
      ],
      "prohibitions": [
        {
          "prohibition_id": "no-real-product-claim",
          "statement": "Do not present the synthetic fixture result as certification or advice for a real product."
        },
        {
          "prohibition_id": "no-external-action",
          "statement": "Do not purchase, install, or operate hardware."
        }
      ],
      "risk_policy": {
        "risk_level": "medium",
        "error_cost": "material",
        "autonomy_mode": "human_approval_required",
        "risk_acceptance": {
          "allowed": false,
          "max_unresolved_challenge_severity": "none"
        }
      },
      "decision_policy": [
        {
          "decision_subject": "motor_driver_selection",
          "authority": {
            "mode": "team_plan",
            "required_role": "decision_authority"
          },
          "human_approval_required": false,
          "independent_from_roles": [
            "executor"
          ]
        }
      ],
      "status": "active"
    }
  }
}
